{"schema_version":"3.0","kind":"reference_section","document":"gitlab-pipeline-execution","anchor":"start-and-watch-gitlab-pipelines","pinned":"d1b2c6fb4e47836a68140873c220935463ebff81","text":"# Start and watch GitLab pipelines\n\n`bin/gitlab_pipeline.py` reads, starts and watches pipelines for one configured GitLab project. It requires only the\nGitLab section of the [target file](access.md#where-the-target-file-comes-from). Start uses the shared confirmed-action\nlifecycle; watch is a bounded read that returns compact graph evidence.\n\nStart reports use the [GitLab action result schema](../schemas/results/gitlab-action.schema.json); watch reports use the\n[pipeline watch result schema](../schemas/results/gitlab-pipeline-watch.schema.json).\n\n","reference":[{"name":"Discover and read","summary":"Read when you need Discover and read.","pointer":"get gitlab-pipeline-execution discover-and-read"},{"name":"Plan and start","summary":"Read when you need Plan and start.","pointer":"get gitlab-pipeline-execution plan-and-start"},{"name":"Retry or start a new identical build","summary":"Read when you need Retry or start a new identical build.","pointer":"get gitlab-pipeline-execution retry-or-start-a-new-identical-build"},{"name":"Watch to settlement","summary":"Read when you need Watch to settlement.","pointer":"get gitlab-pipeline-execution watch-to-settlement"}],"continuation":null}
