{"schema_version":"3.0","kind":"reference_section","document":"access","anchor":"per-computer-access-and-evidence","pinned":"8fea10f7bba9a84b09f211ae8c0ee14b67ff8867","text":"# Per-computer access and evidence\n\nThe installed skill contains instructions and code. Each execution host\nsupplies a nonsecret target file and its own credentials. The target file\nidentifies the authorities its commands use. A Kubernetes collector needs its\nexact context and API server; a GitLab job needs its exact origin. The full\naccess receipt also needs the GitHub repository. A project can select a target\nand its kubeconfig through the [project binding](project-binding.md).\n`gitlab_job.py` can use a GitLab-only target; its job URL selects the exact\nproject for identity and project access read-back before job, pipeline, runner,\nand trace reads.\n\n","reference":[{"name":"Where the target file comes from","summary":"Read when you need Where the target file comes from.","pointer":"get access where-the-target-file-comes-from"},{"name":"Effective credential sources","summary":"Read when you need Effective credential sources.","pointer":"get access effective-credential-sources"},{"name":"Package and functional identity","summary":"Read when you need Package and functional identity.","pointer":"get access package-and-functional-identity"},{"name":"Full three-authority live receipt","summary":"Read when you need Full three-authority live receipt.","pointer":"get access full-three-authority-live-receipt"},{"name":"Automated gates","summary":"Read when you need Automated gates.","pointer":"get access automated-gates"}],"continuation":null}
